{
  "$schema": "https://json-schema.org/draft/2020-12/schema",
  "$id": "https://cdx.dev/conformance/vectors.schema.json",
  "title": "Conformance Known-Answer Vector File",
  "description": "Schema for conformance/vectors/*.json. NON-NORMATIVE: it validates testing artifacts, not CDX documents. Its job is to catch corruption or typos in a file that third parties consume, so the constraints are deliberately tight.",
  "type": "object",
  "required": [
    "suite",
    "specVersion",
    "kind",
    "clause",
    "description",
    "oracle",
    "vectors"
  ],
  "properties": {
    "$schema": {
      "type": "string"
    },
    "suite": {
      "const": "cdx-conformance"
    },
    "specVersion": {
      "type": "string",
      "pattern": "^\\d+\\.\\d+$"
    },
    "kind": {
      "enum": [
        "document-id",
        "manifest-projection",
        "manifest-scope",
        "manifest-projection-errors",
        "jws-header",
        "jws-signing-input",
        "jwk-thumbprint",
        "multibase",
        "block-merkle-root",
        "block-merkle-inclusion",
        "block-merkle-leaf",
        "provenance-timestamp",
        "canonicalize",
        "canonicalize-robustness",
        "structural-constraints"
      ]
    },
    "clause": {
      "type": "string",
      "description": "The specification section these vectors pin."
    },
    "description": {
      "type": "string",
      "minLength": 20
    },
    "oracle": {
      "type": "string",
      "minLength": 20,
      "description": "How the expected values were derived. Required because a vector whose expectations came from the implementation under test proves nothing — it snapshots a bug instead of catching it."
    },
    "requires": {
      "type": "array",
      "items": {
        "type": "string",
        "pattern": "^[a-z0-9]+(:[a-z0-9-]+)?$"
      },
      "uniqueItems": true,
      "description": "Capability keys (capabilities.json) that EVERY vector in this file needs — the file exercises a feature gated on them (e.g. the security extension, or provenance verification). Merged with each vector's own `requires`. Absent means the file is pure core and always in scope."
    },
    "vectors": {
      "type": "array",
      "minItems": 1,
      "items": {
        "$ref": "#/$defs/vector"
      }
    }
  },
  "additionalProperties": false,
  "$defs": {
    "contentHash": {
      "type": "string",
      "pattern": "^(sha256:[a-f0-9]{64}|sha384:[a-f0-9]{96}|sha512:[a-f0-9]{128}|sha3-256:[a-f0-9]{64}|sha3-512:[a-f0-9]{128}|blake3:[a-f0-9]{64})$"
    },
    "vector": {
      "type": "object",
      "required": [
        "name",
        "description"
      ],
      "allOf": [
        {
          "$comment": "A vector asserts a value or a rejection, never both: expectReject is mutually exclusive with expectedCanonicalJcs.",
          "if": {
            "required": [
              "expectReject"
            ]
          },
          "then": {
            "not": {
              "required": [
                "expectedCanonicalJcs"
              ]
            }
          }
        }
      ],
      "properties": {
        "name": {
          "type": "string",
          "minLength": 1,
          "pattern": "^[a-z0-9]+(-[a-z0-9.]+)*$"
        },
        "description": {
          "type": "string",
          "minLength": 10
        },
        "local": {
          "not": {},
          "description": "MUST NOT appear: `local` is this-implementation-only data and is stripped at the export boundary. Its presence means the boundary leaked."
        },
        "expectedId": {
          "$ref": "#/$defs/contentHash"
        },
        "expectedSha256": {
          "$ref": "#/$defs/contentHash"
        },
        "expectedCanonicalJcs": {
          "type": "string",
          "description": "The RFC 8785 (JCS) byte string a faithful canonicalizer MUST produce. Present on a transform vector; absent on a reject vector."
        },
        "expectReject": {
          "const": true,
          "description": "Marks a vector whose input a conformant implementation MUST reject (the operation errors). Used where no portable defect code exists — the assertion is rejection, not an identifier. Mutually exclusive with expectedCanonicalJcs."
        },
        "structural": {
          "type": "object",
          "description": "A structural-constraints case: a content-tree / file-level invariant JSON Schema cannot express. The adapter runs the named rule's checker over `instance` and reports whether it FLAGGED; the suite compares that to `expect.valid`. The case is self-describing — it ships the block-type recognition its outcome depends on, so no schema-derived state is needed.",
          "required": [
            "rule",
            "instance",
            "expect"
          ],
          "additionalProperties": false,
          "allOf": [
            {
              "$comment": "Block-tree rules need the root context and the block-type recognition their outcome depends on; omitting either would silently mis-decide the case.",
              "if": {
                "properties": {
                  "rule": {
                    "enum": [
                      "upward-containment",
                      "figure-cardinality",
                      "definition-item-cardinality"
                    ]
                  }
                },
                "required": ["rule"]
              },
              "then": {
                "required": ["blockTypes", "root"]
              }
            },
            {
              "$comment": "asset-index-consistency compares a manifest category (instance) against its index.",
              "if": {
                "properties": {
                  "rule": { "const": "asset-index-consistency" }
                },
                "required": ["rule"]
              },
              "then": {
                "required": ["index"]
              }
            }
          ],
          "properties": {
            "rule": {
              "enum": [
                "upward-containment",
                "figure-cardinality",
                "definition-item-cardinality",
                "anchor-range",
                "page-number-integrity",
                "asset-index-consistency",
                "id-uniqueness"
              ],
              "description": "Which structural rule to run — also the portable pass/fail discriminator."
            },
            "instance": {
              "description": "The primary input: a block tree (containment/cardinality), an anchor node/string (anchor-range), a precise-layout node (page-number-integrity), the manifest asset CATEGORY object (asset-index-consistency), or an items array (id-uniqueness)."
            },
            "index": {
              "description": "asset-index-consistency only: the asset INDEX object (its `assets[]`). Ignored by other rules."
            },
            "root": {
              "enum": [
                "document",
                "excerpt"
              ],
              "description": "Block-tree rules only: the root context. The upward-containment exemption keys off `excerpt`, so the same instance can be valid at excerpt root and invalid at document root — it MUST be explicit."
            },
            "blockTypes": {
              "type": "array",
              "items": {
                "type": "string"
              },
              "uniqueItems": true,
              "description": "Block-tree rules only: the `type` strings the adapter MUST treat as content blocks when walking `instance`. Shipped in the vector (not derived from a schema) because the fire/clean outcome depends on which nodes count as blocks — e.g. a tableCell under a paragraph fires only because `paragraph` is recognized, giving a concrete non-excerpt parent."
            },
            "expect": {
              "type": "object",
              "required": [
                "valid"
              ],
              "additionalProperties": false,
              "properties": {
                "valid": {
                  "type": "boolean",
                  "description": "`true`: a conformant reader accepts the instance (the rule does NOT flag it). `false`: the instance violates the rule (it MUST flag)."
                }
              }
            }
          }
        },
        "robustness": {
          "type": "object",
          "description": "A canonicalize-robustness case: GENERATIVE (no literal deep structure, which could itself exceed a parser's own limits). The adapter expands it relative to ITS OWN declared canonicalization depth bound, so the case is portable across implementations with different bounds.",
          "required": [
            "part",
            "depth",
            "of",
            "expect"
          ],
          "additionalProperties": false,
          "properties": {
            "part": {
              "enum": [
                "content",
                "metadata"
              ],
              "description": "Which part carries the deep structure."
            },
            "depth": {
              "type": "object",
              "required": [
                "boundOffset"
              ],
              "additionalProperties": false,
              "properties": {
                "boundOffset": {
                  "type": "integer",
                  "minimum": -2,
                  "maximum": 1,
                  "description": "Nest `of` to (the adapter's declared max canonicalization depth) + boundOffset, measured at the part's baseline. `boundOffset: 1` is one level past the bound and MUST reject with a catchable error (never a crash); `0` is the exact bound. The range is kept small so a generated depth stays near the bound on every implementation — a large literal depth could overflow a recursive-descent JSON parser UPSTREAM of the depth guard, turning a catchable rejection into an uncatchable crash. NOTE: a `metadata` term sits two levels below the root (dublinCore → terms → term), so its effective absolute depth is 2 higher than a `content` case at the same boundOffset — a `metadata` accept needs boundOffset ≤ -2."
                }
              }
            },
            "of": {
              "type": [
                "string",
                "number",
                "boolean",
                "null"
              ],
              "description": "The innermost scalar the nesting wraps. Restricted to a scalar so a case cannot smuggle a literal deep structure in via `of`, defeating the generative design."
            },
            "expect": {
              "enum": [
                "accept",
                "reject"
              ],
              "description": "`accept`: canonicalization succeeds. `reject`: it fails with a CATCHABLE error — a typed rejection the adapter reports, not a native stack overflow that crashes it."
            }
          }
        },
        "expect": {
          "type": "object",
          "required": [
            "code"
          ],
          "properties": {
            "code": {
              "type": "string",
              "pattern": "^CDX-E-[A-Z0-9]+(-[A-Z0-9]+)*$"
            }
          },
          "additionalProperties": false
        },
        "requires": {
          "type": "array",
          "items": {
            "type": "string",
            "pattern": "^[a-z0-9]+(:[a-z0-9-]+)?$"
          },
          "uniqueItems": true,
          "description": "Capability keys (from capabilities.json) this vector needs. An adapter that does not declare all of them has the vector SKIPPED — reported explicitly, never counted as a pass. Absent means the vector is pure core and always in scope."
        },
        "severity": {
          "enum": [
            "MUST",
            "SHOULD"
          ],
          "description": "Normative weight of this vector. Absent defaults to MUST: a failure is fatal. SHOULD failures are advisory and never fatal."
        }
      }
    }
  }
}
