{
  "$schema": "./vectors.schema.json",
  "suite": "cdx-conformance",
  "specVersion": "0.1",
  "kind": "jws-signing-input",
  "clause": "Security Extension section 3.4",
  "description": "The detached signing input BASE64URL(protected) + \".\" + JCS(scope).",
  "oracle": "Expected bytes are HAND-AUTHORED and their digests were computed from exactly those bytes by an out-of-band tool (shasum), never by this repository's implementation — so a mistyped vector cannot pass by matching a wrong implementation.",
  "vectors": [
    {
      "name": "min-content-only",
      "description": "Minimal header + a content-only scope (documentId alone).",
      "header": {
        "alg": "ES256",
        "b64": false,
        "crit": [
          "b64"
        ]
      },
      "scope": {
        "documentId": "sha256:e7ad94ba3634250646b41d62bc40cfc0c6aba0de995c2193fd2ebae77eed35c7"
      },
      "expectedSha256": "sha256:6df5f4e1a284c4c61734869c76f325a9b1141d76267de3e3856cd29b75ce6608"
    },
    {
      "name": "full-manifest-covering",
      "description": "A full JAdES-inspired header (x5c/x5t#S256/sigT) + a manifest-covering scope — the signed-document case.",
      "header": {
        "alg": "ES256",
        "b64": false,
        "crit": [
          "b64"
        ],
        "sigT": "2025-01-15T10:00:00Z",
        "x5c": [
          "MIIBixUNVERIFIEDplaceholderDERcertificateBASE64FORILLUSTRATIONxw=="
        ],
        "x5t#S256": "AAAAAAAAAAAAAAAAAAAAAAAAAAAAAAAAAAAAAAAAAAA"
      },
      "scope": {
        "documentId": "sha256:e7ad94ba3634250646b41d62bc40cfc0c6aba0de995c2193fd2ebae77eed35c7",
        "manifest": {
          "cdx": "0.1",
          "state": "frozen",
          "content": {
            "path": "content/document.json",
            "hash": "sha256:f28bbc78915107cc2973f10da7c5c0943414a03b274cdf6193f7b34d433ef026"
          },
          "extensions": [
            {
              "id": "cdx.security",
              "version": "0.1",
              "required": true
            }
          ],
          "lineage": {
            "parent": null,
            "version": 1
          }
        }
      },
      "expectedSha256": "sha256:982c1edf31749950f8b91a0fc16a757376c9f517f32e0870b2b669c1e565dfe9"
    },
    {
      "name": "eddsa-sha384-content-only",
      "description": "EdDSA + a sha384 document id, confirming alg-agility and a longer hash flow through the construction unchanged.",
      "header": {
        "alg": "EdDSA",
        "b64": false,
        "crit": [
          "b64"
        ]
      },
      "scope": {
        "documentId": "sha384:aaaaaaaaaaaaaaaaaaaaaaaaaaaaaaaaaaaaaaaaaaaaaaaaaaaaaaaaaaaaaaaaaaaaaaaaaaaaaaaaaaaaaaaaaaaaaaaa"
      },
      "expectedSha256": "sha256:144dee61769761a1914a1a793781ac2736064bf89b598c0a34f88e271effb31f"
    },
    {
      "name": "kid-did-key-content-only",
      "description": "A keyId-path (did:key) header + a content-only scope — confirms the signing-input construction is identical across credential paths (only the header contents differ).",
      "header": {
        "alg": "EdDSA",
        "b64": false,
        "crit": [
          "b64"
        ],
        "kid": "did:key:z6MkUNVERIFIEDplaceholderEd25519keyForIllustration",
        "sigT": "2025-01-15T10:00:00Z"
      },
      "scope": {
        "documentId": "sha256:e7ad94ba3634250646b41d62bc40cfc0c6aba0de995c2193fd2ebae77eed35c7"
      },
      "expectedSha256": "sha256:49cbf20981ac75ee6e5be5e7e891b75b27b8dcbef26a0592f3f71c1ff42bce3c"
    },
    {
      "name": "kid-did-web-content-only",
      "description": "A did:web header (kid + jkt) + content-only scope — confirms the signing-input construction is unchanged for the out-of-band keyId path.",
      "header": {
        "alg": "EdDSA",
        "b64": false,
        "crit": [
          "b64"
        ],
        "kid": "did:web:example.com:alice",
        "jkt": "kPrK_qmxVWaYVA9wwBF6Iuo3vVzz7TxHCTwXBygrS4k",
        "sigT": "2025-01-15T10:00:00Z"
      },
      "scope": {
        "documentId": "sha256:e7ad94ba3634250646b41d62bc40cfc0c6aba0de995c2193fd2ebae77eed35c7"
      },
      "expectedSha256": "sha256:278bff47816fa8651c08c8da465485819e7b22d9bcd5b99e00b2ef14a7c7bbc1"
    }
  ]
}
